{
  "application": {
    "type": { "value": "pa.part1.classA", "description": "prior_approval" },
    "reference": "25-00240-PA1A",
    "fullReference": "SWK-25-00240-PA1A",
    "targetDate": "2025-04-08",
    "expiryDate": "2025-03-25",
    "receivedAt": "2025-03-04T14:36:32.999+00:00",
    "validAt": "2025-03-04T00:00:00.000+00:00",
    "publishedAt": "2025-03-06T14:22:12.293+00:00",
    "determinedAt": null,
    "determinationDate": null,
    "decision": null,
    "status": "Appeal allowed",
    "consultation": {
      "startDate": null,
      "endDate": null,
      "publicUrl": "https://southwark.bops-applicants.localhost:3001/planning_applications/25-00240-PA1A",
      "publishedComments": [],
      "consulteeComments": []
    },
    "pressNotice": null
  },
  "property": {
    "address": {
      "latitude": 22.87483014329466,
      "longitude": 105.04327269762632,
      "title": "7796 Sherie Mountain",
      "singleLine": "7796 Sherie Mountain, Bashirianland, 78923",
      "uprn": "00254420",
      "town": "Bashirianland",
      "postcode": "78923"
    },
    "boundary": { "site": null }
  },
  "proposal": {
    "description": "Non voluptatum quo et.",
    "reportingType": null,
    "ownerIsPlanningAuthority": false
  },
  "applicant": {
    "type": null,
    "address": null,
    "ownership": null,
    "agent": { "address": null }
  },
  "officer": { "name": "Zena Spinka" },
  "data": {
    "appeal": {
      "reason": "too slow!",
      "lodgedDate": "2025-02-26",
      "validatedDate": "2025-02-27",
      "startedDate": "2025-02-28",
      "decisionDate": "2025-03-02",
      "decision": "allowed",
      "files": [
        {
          "name": "01_decision_type_counts.png",
          "url": "/files/b48as3tuafybda00zffy1h8ym0mu",
          "type": [
            {
              "value": "internal.appealDecision",
              "description": "Appeal Decision"
            }
          ],
          "createdAt": "2025-03-06T20:42:18.299+00:00",
          "applicantDescription": null,
          "metadata": { "byteSize": 312599, "contentType": "image/png" }
        },
        {
          "name": "03_average_days_to_decision.png",
          "url": "/files/93dj4n9hw8px6q1wgnm7hqwjwyu7",
          "type": [
            {
              "value": "internal.appealDecision",
              "description": "Appeal Decision"
            }
          ],
          "createdAt": "2025-03-06T20:42:18.400+00:00",
          "applicantDescription": null,
          "metadata": { "byteSize": 338776, "contentType": "image/png" }
        },
        {
          "name": "02_decision_by_app_type.png",
          "url": "/files/n2jd2xor3sl8514m49a4rn8rf3p4",
          "type": [
            {
              "value": "internal.appealDecision",
              "description": "Appeal Decision"
            }
          ],
          "createdAt": "2025-03-06T20:42:18.415+00:00",
          "applicantDescription": null,
          "metadata": { "byteSize": 890308, "contentType": "image/png" }
        },
        {
          "name": "04_applications_without_decision.png",
          "url": "/files/gd21huup5zg82wl4qy38gia2tapx",
          "type": [
            {
              "value": "internal.appealDecision",
              "description": "Appeal Decision"
            }
          ],
          "createdAt": "2025-03-06T20:42:18.428+00:00",
          "applicantDescription": null,
          "metadata": { "byteSize": 258315, "contentType": "image/png" }
        }
      ]
    }
  }
}
